{
  "$schema": "https://json-schema.org/draft/2020-12/schema",
  "$id": "urn:gowm:v0.7.1:wsgs-southbound-operation-lock-v2",
  "title": "WsgsSouthboundOperationLockV2V071",
  "type": "object",
  "additionalProperties": false,
  "required": ["schemaVersion", "gatewayContractVersion", "consumerContractPackage", "contractCatalogRevision", "semanticCatalogHash", "availabilityContractHash", "snapshotContractHash", "delegationContractHash", "scopeModel", "resourceIdEncodingRevision", "canonicalOrderingRevision", "authorizedDowngradeResourceRetentionRevision", "historicalEventSetSeparationRevision", "defaultOperations", "previewOperations"],
  "properties": {
    "schemaVersion": { "const": "2.0" },
    "gatewayContractVersion": { "const": "0.7.1" },
    "consumerContractPackage": {
      "type": "object", "additionalProperties": false, "required": ["name", "version", "integrity"],
      "properties": {
        "name": { "const": "@gowm/world-gateway-contracts" },
        "version": { "const": "0.7.1" },
        "integrity": { "type": "string", "pattern": "^sha512-[A-Za-z0-9+/=]+$" }
      }
    },
    "contractCatalogRevision": { "type": "string", "pattern": "^sha256:[0-9a-f]{64}$" },
    "semanticCatalogHash": { "type": "string", "pattern": "^sha256:[0-9a-f]{64}$" },
    "availabilityContractHash": { "type": "string", "pattern": "^sha256:[0-9a-f]{64}$" },
    "snapshotContractHash": { "type": "string", "pattern": "^sha256:[0-9a-f]{64}$" },
    "delegationContractHash": { "type": "string", "pattern": "^sha256:[0-9a-f]{64}$" },
    "scopeModel": { "const": "SINGLE_SCOPE_V1" },
    "resourceIdEncodingRevision": { "const": "SNAPSHOT_RESOURCE_ID_V1_512" },
    "canonicalOrderingRevision": { "const": "UNICODE_CODE_POINT_BINARY_V1" },
    "authorizedDowngradeResourceRetentionRevision": { "const": "ACTUAL_PROVIDER_RESOURCES_RETAINED_WITHOUT_PINNING_STRENGTHENING_V1" },
    "historicalEventSetSeparationRevision": { "const": "CURRENT_AND_INTERVAL_INPUT_EVENT_SETS_DISTINCT_V1" },
    "defaultOperations": { "$ref": "#/$defs/operationList" },
    "previewOperations": { "$ref": "#/$defs/operationList" }
  },
  "$defs": {
    "operationList": {
      "type": "array",
      "items": {
        "type": "object", "additionalProperties": false,
        "required": ["operationId", "operationVersion", "inputSchemaHash", "outputSchemaHash", "semanticProfileHash", "maturity", "requiredPermissions", "snapshotSupport"],
        "properties": {
          "operationId": { "type": "string" }, "operationVersion": { "type": "string" },
          "inputSchemaHash": { "type": "string", "pattern": "^sha256:[0-9a-f]{64}$" },
          "outputSchemaHash": { "type": "string", "pattern": "^sha256:[0-9a-f]{64}$" },
          "semanticProfileHash": { "type": "string", "pattern": "^sha256:[0-9a-f]{64}$" },
          "maturity": { "enum": ["STABLE", "PREVIEW"] },
          "requiredPermissions": { "type": "array", "uniqueItems": true, "items": { "type": "string" } },
          "snapshotSupport": { "enum": ["NONE", "BEST_EFFORT", "CONSISTENT_AT_START", "PINNED"] }
        }
      }
    }
  }
}
