{
  "schemaVersion": "2.0",
  "gatewayContractVersion": "0.7.1",
  "consumerContractPackage": {
    "name": "@gowm/world-gateway-contracts",
    "version": "0.7.1",
    "integrity": "sha512-1XtXNrTb7CWl5+b3t/sqhetvIm2zcOkArFcs1OUBW1SxT77Jf1s+vRSqUw8TnikBUehu3DUfwkSCJI1ilYMGEg=="
  },
  "scopeModel": "SINGLE_SCOPE_V1",
  "resourceIdEncodingRevision": "SNAPSHOT_RESOURCE_ID_V1_512",
  "canonicalOrderingRevision": "UNICODE_CODE_POINT_BINARY_V1",
  "authorizedDowngradeResourceRetentionRevision": "ACTUAL_PROVIDER_RESOURCES_RETAINED_WITHOUT_PINNING_STRENGTHENING_V1",
  "historicalEventSetSeparationRevision": "CURRENT_AND_INTERVAL_INPUT_EVENT_SETS_DISTINCT_V1",
  "contractCatalogRevision": "sha256:8a368dd91841589aed86723a86c49a382dd3a1040f1be6e17adc4fcc101806c2",
  "semanticCatalogHash": "sha256:566b1a90f2d38fd65e78d59ebfc0a54de5c7d598a4e36fbe10c8591814b4be7d",
  "availabilityContractHash": "sha256:66d6cfe2679d6bdd0cf6f22cb7153d1f5f4c934ebc286f6bac33ab6bd7eb4036",
  "snapshotContractHash": "sha256:7a984eef06eec1ed19b21a6649644cc1b8a7e1d653c8b6f9b06490a8d316d185",
  "delegationContractHash": "sha256:a80e51793f46a90b2f627937fce06bc31fa3489a87a509185b9813f82ede1c4a",
  "defaultOperations": [
    {
      "operationId": "catalog.get",
      "operationVersion": "1.0",
      "inputSchemaHash": "sha256:dbfccaff85081bcc161d9e83c4e8959f6ecc35c3c726e01ce83547925dcc7772",
      "outputSchemaHash": "sha256:d3ed28efd4b24c21ed91fda200e656a9b492bac88e1fe8d8dd2488ee78c76cf4",
      "semanticProfileHash": "sha256:76736ff33a0568e7ba253b29c210a92cd7ee09f7780856de9c9faa8cb8fa8e00",
      "maturity": "STABLE",
      "requiredPermissions": [
        "dataset:read"
      ],
      "snapshotSupport": "CONSISTENT_AT_START"
    },
    {
      "operationId": "catalog.search",
      "operationVersion": "1.0",
      "inputSchemaHash": "sha256:d15fc90c9641712ef22d536c931bedf0a6f8e7af46a93172a48aec8f373e51aa",
      "outputSchemaHash": "sha256:85c9b79082dca6abba93becc6ffca0bcb5a86934c61685a6e0a05863bd6430fc",
      "semanticProfileHash": "sha256:384d9f9fdd83f9c6799148478e12955385b3d4adca375ab2e2399f6d2fa8c33a",
      "maturity": "STABLE",
      "requiredPermissions": [
        "dataset:read"
      ],
      "snapshotSupport": "CONSISTENT_AT_START"
    },
    {
      "operationId": "coverage.road.expand-geojson",
      "operationVersion": "1.0",
      "inputSchemaHash": "sha256:64f0a1a67d9802a0d41f087f3482158ba7bafa5722dd94cda5314786beb24f37",
      "outputSchemaHash": "sha256:e5c8b4845f9f0717750adb2b5f1b0303f00fd302c1cb962a0336af37474c1b0b",
      "semanticProfileHash": "sha256:0487055638b8310c4b5d6d304e45bab9b628e0b4a03d62d63a7f5ad51772250a",
      "maturity": "STABLE",
      "requiredPermissions": [
        "data:read"
      ],
      "snapshotSupport": "CONSISTENT_AT_START"
    },
    {
      "operationId": "coverage.road.plan",
      "operationVersion": "1.0",
      "inputSchemaHash": "sha256:01a1ff79cfdb0277f25e500c4fd6662564e25e15ad03be7f241d03047cc2100e",
      "outputSchemaHash": "sha256:6780705366b28bf95ee1868b48587839f50acbe5aa950b3ed256b7d64bd30c50",
      "semanticProfileHash": "sha256:733c634a3dd7d695e804f4fec096e7be7bc4c77f456ac0c0f87dd4aa08eff78b",
      "maturity": "STABLE",
      "requiredPermissions": [
        "data:read"
      ],
      "snapshotSupport": "CONSISTENT_AT_START"
    },
    {
      "operationId": "coverage.road.select-obligations",
      "operationVersion": "1.0",
      "inputSchemaHash": "sha256:01a1ff79cfdb0277f25e500c4fd6662564e25e15ad03be7f241d03047cc2100e",
      "outputSchemaHash": "sha256:f453949199ebdf7eea944c5eac3fbff95bfc52cdb0f8a33abecb38fe6448cbbe",
      "semanticProfileHash": "sha256:0487055638b8310c4b5d6d304e45bab9b628e0b4a03d62d63a7f5ad51772250a",
      "maturity": "STABLE",
      "requiredPermissions": [
        "data:read"
      ],
      "snapshotSupport": "CONSISTENT_AT_START"
    },
    {
      "operationId": "coverage.road.validate",
      "operationVersion": "1.0",
      "inputSchemaHash": "sha256:01a1ff79cfdb0277f25e500c4fd6662564e25e15ad03be7f241d03047cc2100e",
      "outputSchemaHash": "sha256:f8df6f34dca1ffeab2dcbca60be2dfecc408a3312b359816fc16be4ca125f55a",
      "semanticProfileHash": "sha256:73720450302201fa03cd0af993b8022560041455e46577cc1c5af4b72d8a98bb",
      "maturity": "STABLE",
      "requiredPermissions": [
        "data:read"
      ],
      "snapshotSupport": "CONSISTENT_AT_START"
    },
    {
      "operationId": "coverage.road.verify",
      "operationVersion": "1.0",
      "inputSchemaHash": "sha256:f8f242440dbb82ea5790ae163455a838d53da451e0481fa36c2b111c423dfcfa",
      "outputSchemaHash": "sha256:56063206dc0164bd273a69784a4cc91a9211130f7f71aa2dbbf776cbe20f9584",
      "semanticProfileHash": "sha256:b81295ca3df9d62f1999c91d2ff4379e7676e0232a859ad5ec255996fb84b745",
      "maturity": "STABLE",
      "requiredPermissions": [
        "data:read"
      ],
      "snapshotSupport": "CONSISTENT_AT_START"
    },
    {
      "operationId": "network.connectivity.inspect",
      "operationVersion": "1.0",
      "inputSchemaHash": "sha256:d63fe16bae3534403a320abd21c79d98c9d6914c694cbe810d6773913cf084cb",
      "outputSchemaHash": "sha256:be1fbd02ea7c8c826c910dbbf742bde188ac19037acc419490f1529219dbbe57",
      "semanticProfileHash": "sha256:309a62a867da227b7881f22d35253c97bee3a202c332f7949e4b27f908d50637",
      "maturity": "STABLE",
      "requiredPermissions": [
        "data:read"
      ],
      "snapshotSupport": "CONSISTENT_AT_START"
    },
    {
      "operationId": "network.graph.diagnose",
      "operationVersion": "1.0",
      "inputSchemaHash": "sha256:d63fe16bae3534403a320abd21c79d98c9d6914c694cbe810d6773913cf084cb",
      "outputSchemaHash": "sha256:be1fbd02ea7c8c826c910dbbf742bde188ac19037acc419490f1529219dbbe57",
      "semanticProfileHash": "sha256:309a62a867da227b7881f22d35253c97bee3a202c332f7949e4b27f908d50637",
      "maturity": "STABLE",
      "requiredPermissions": [
        "data:read"
      ],
      "snapshotSupport": "CONSISTENT_AT_START"
    },
    {
      "operationId": "network.graph.get",
      "operationVersion": "1.0",
      "inputSchemaHash": "sha256:d63fe16bae3534403a320abd21c79d98c9d6914c694cbe810d6773913cf084cb",
      "outputSchemaHash": "sha256:947f7f3d6a35b8e3bda52722b16f7e42dc612820c12fbd6a3b1af855dd35411c",
      "semanticProfileHash": "sha256:ad166af348308952ccfc88f85ca9693364e50c12519209a106a3cc6a148f163e",
      "maturity": "STABLE",
      "requiredPermissions": [
        "data:read"
      ],
      "snapshotSupport": "CONSISTENT_AT_START"
    },
    {
      "operationId": "network.graph.list",
      "operationVersion": "1.0",
      "inputSchemaHash": "sha256:d63fe16bae3534403a320abd21c79d98c9d6914c694cbe810d6773913cf084cb",
      "outputSchemaHash": "sha256:be1fbd02ea7c8c826c910dbbf742bde188ac19037acc419490f1529219dbbe57",
      "semanticProfileHash": "sha256:309a62a867da227b7881f22d35253c97bee3a202c332f7949e4b27f908d50637",
      "maturity": "STABLE",
      "requiredPermissions": [
        "data:read"
      ],
      "snapshotSupport": "CONSISTENT_AT_START"
    },
    {
      "operationId": "network.path.expand",
      "operationVersion": "1.0",
      "inputSchemaHash": "sha256:c4bc84c55f7f67266f99ee799bb8c826d45df2d80ff9ad902e8d1a5669db7794",
      "outputSchemaHash": "sha256:c4bc84c55f7f67266f99ee799bb8c826d45df2d80ff9ad902e8d1a5669db7794",
      "semanticProfileHash": "sha256:6b69890bd6c146a0fafc2a8ffde2c12b4d0296dd75241a255f3a615f428ada91",
      "maturity": "STABLE",
      "requiredPermissions": [
        "data:read"
      ],
      "snapshotSupport": "CONSISTENT_AT_START"
    },
    {
      "operationId": "network.path.shortest",
      "operationVersion": "1.0",
      "inputSchemaHash": "sha256:b1bed7cd90744523d035567b0fbae0382a8fddc014728fef93158cadbdc48355",
      "outputSchemaHash": "sha256:c4bc84c55f7f67266f99ee799bb8c826d45df2d80ff9ad902e8d1a5669db7794",
      "semanticProfileHash": "sha256:6b69890bd6c146a0fafc2a8ffde2c12b4d0296dd75241a255f3a615f428ada91",
      "maturity": "STABLE",
      "requiredPermissions": [
        "data:read"
      ],
      "snapshotSupport": "CONSISTENT_AT_START"
    },
    {
      "operationId": "network.path.verify",
      "operationVersion": "1.0",
      "inputSchemaHash": "sha256:c4bc84c55f7f67266f99ee799bb8c826d45df2d80ff9ad902e8d1a5669db7794",
      "outputSchemaHash": "sha256:76477a2cf770bb5a72208882aa841ac7b13f60e0516a4726ff265efcbdbea8bd",
      "semanticProfileHash": "sha256:041a33be2d8833bd58e5685e76a73c17a22e1843bb3a7ec6682c73bdddac1021",
      "maturity": "STABLE",
      "requiredPermissions": [
        "data:read"
      ],
      "snapshotSupport": "CONSISTENT_AT_START"
    },
    {
      "operationId": "network.snap.point",
      "operationVersion": "1.0",
      "inputSchemaHash": "sha256:d63fe16bae3534403a320abd21c79d98c9d6914c694cbe810d6773913cf084cb",
      "outputSchemaHash": "sha256:e606e231164ceecdece02310395b6b4742ab45b92d8a9713f196b1779dc257fd",
      "semanticProfileHash": "sha256:8363cef0e0100152b6fc13f69d382330b5dee8a9d659387c0e6ecdf843e75623",
      "maturity": "STABLE",
      "requiredPermissions": [
        "data:read"
      ],
      "snapshotSupport": "CONSISTENT_AT_START"
    },
    {
      "operationId": "network.snap.points",
      "operationVersion": "1.0",
      "inputSchemaHash": "sha256:d63fe16bae3534403a320abd21c79d98c9d6914c694cbe810d6773913cf084cb",
      "outputSchemaHash": "sha256:e606e231164ceecdece02310395b6b4742ab45b92d8a9713f196b1779dc257fd",
      "semanticProfileHash": "sha256:8363cef0e0100152b6fc13f69d382330b5dee8a9d659387c0e6ecdf843e75623",
      "maturity": "STABLE",
      "requiredPermissions": [
        "data:read"
      ],
      "snapshotSupport": "CONSISTENT_AT_START"
    },
    {
      "operationId": "reference.get",
      "operationVersion": "1.0",
      "inputSchemaHash": "sha256:dbfccaff85081bcc161d9e83c4e8959f6ecc35c3c726e01ce83547925dcc7772",
      "outputSchemaHash": "sha256:276d3d168e37dd13abfd705d308b16b128b6e6519daf00f98830bd570593a25c",